{
  "atlas_version": "0.1",
  "project": {
    "name": "Leave Desk",
    "summary": "Employees ask for time off; small requests are approved straight away, managers can approve their own short breaks, everything else goes to a manager. HR gets a monthly summary.",
    "generated_at": "2026-10-09T00:00:00Z",
    "scanner_version": "hand-written",
    "languages": ["python"],
    "frameworks": ["fastapi", "sqlalchemy", "celery", "pydantic"]
  },
  "modules": [
    {
      "id": "leave",
      "name": "Time off",
      "summary": "How a request for time off is made, approved or declined, and taken from the balance.",
      "drawn": true,
      "workflows": ["request-time-off"],
      "files": ["app/leave/models.py", "app/leave/schemas.py", "app/leave/routes.py", "app/leave/service.py", "app/leave/balance.py", "app/leave/tasks.py"],
      "entry_points": [
        { "kind": "api_route", "label": "POST /leave", "evidence": [{ "path": "app/leave/routes.py", "start_line": 14, "end_line": 16, "symbol": "submit_leave" }] },
        { "kind": "api_route", "label": "GET /leave/mine", "evidence": [{ "path": "app/leave/routes.py", "start_line": 19, "end_line": 21, "symbol": "my_leave" }] },
        { "kind": "api_route", "label": "POST /leave/{request_id}/approve", "evidence": [{ "path": "app/leave/routes.py", "start_line": 24, "end_line": 26, "symbol": "approve_leave" }] },
        { "kind": "api_route", "label": "POST /leave/{request_id}/reject", "evidence": [{ "path": "app/leave/routes.py", "start_line": 29, "end_line": 31, "symbol": "reject_leave" }] },
        { "kind": "background_job", "label": "leave.notify_manager", "evidence": [{ "path": "app/leave/tasks.py", "start_line": 8, "end_line": 13, "symbol": "notify_manager" }] },
        { "kind": "background_job", "label": "leave.notify_decision", "evidence": [{ "path": "app/leave/tasks.py", "start_line": 16, "end_line": 21, "symbol": "notify_decision" }] }
      ],
      "evidence": [{ "path": "app/leave/service.py", "start_line": 1, "end_line": 1 }],
      "provenance": "human"
    },
    {
      "id": "reports",
      "name": "HR reporting",
      "summary": "Monthly totals of approved leave for HR, plus a planned spreadsheet export.",
      "drawn": true,
      "workflows": ["monthly-summary", "export-leave-data"],
      "files": ["app/reports/routes.py", "app/reports/service.py", "app/reports/tasks.py"],
      "entry_points": [
        { "kind": "scheduled_job", "label": "reports.monthly_summary (1st of month, 06:00)", "evidence": [{ "path": "app/worker.py", "start_line": 8, "end_line": 13 }, { "path": "app/reports/tasks.py", "start_line": 11, "end_line": 17, "symbol": "monthly_summary" }] },
        { "kind": "api_route", "label": "POST /reports/monthly/run", "evidence": [{ "path": "app/reports/routes.py", "start_line": 16, "end_line": 19, "symbol": "run_monthly_summary" }] },
        { "kind": "api_route", "label": "GET /reports/export", "evidence": [{ "path": "app/reports/routes.py", "start_line": 22, "end_line": 24, "symbol": "export" }] }
      ],
      "evidence": [{ "path": "app/reports/service.py", "start_line": 1, "end_line": 1 }],
      "provenance": "human"
    }
  ],
  "links": [
    {
      "from_stage": "request-time-off/deduct-balance",
      "to_stage": "monthly-summary/count-approved-leave",
      "label": "approved leave is counted in next month's summary",
      "evidence": [
        { "path": "app/leave/service.py", "start_line": 72, "end_line": 77, "symbol": "_approve" },
        { "path": "app/reports/service.py", "start_line": 10, "end_line": 19, "symbol": "approved_leave_by_person" }
      ],
      "provenance": "human"
    }
  ],
  "workflows": [
    {
      "id": "request-time-off",
      "module": "leave",
      "name": "Request time off",
      "summary": "An employee asks for days off. Depending on length and who is asking, it is approved automatically, by the requester (if a manager), or by their manager. Approved days come off the balance and the employee is told.",
      "actors": ["Employee", "Manager", "System"],
      "stages": [
        {
          "id": "request-time-off/submit",
          "name": "Employee asks for time off",
          "description": "The employee picks dates and gives a reason. The request is refused straight away if they don't have enough days left.",
          "actor": "Employee",
          "kind": "start",
          "files": [
            { "file": "app/leave/routes.py", "contribution": "owner", "label": "routes.py: submit_leave" },
            { "file": "app/leave/service.py", "contribution": "owner", "label": "service.py: submit_request" },
            { "file": "app/leave/schemas.py", "contribution": "helper", "label": "schemas.py: LeaveRequestIn" },
            { "file": "app/leave/balance.py", "contribution": "helper", "label": "balance.py: has_enough" },
            { "file": "app/shared/auth.py", "contribution": "shared_system", "label": "auth.py: current_employee" },
            { "file": "app/shared/audit.py", "contribution": "shared_system", "label": "audit.py: record" }
          ],
          "evidence": [
            { "path": "app/leave/routes.py", "start_line": 14, "end_line": 16, "symbol": "submit_leave" },
            { "path": "app/leave/service.py", "start_line": 22, "end_line": 29, "symbol": "submit_request" }
          ],
          "provenance": "human"
        },
        {
          "id": "request-time-off/choose-route",
          "name": "Decide who needs to approve",
          "description": "One day or less is approved automatically. A manager asking for up to three days approves it themselves. Everything else goes to their manager.",
          "actor": "System",
          "kind": "decision",
          "files": [
            { "file": "app/leave/service.py", "contribution": "owner", "label": "service.py: choose_route" }
          ],
          "evidence": [{ "path": "app/leave/service.py", "start_line": 13, "end_line": 19, "symbol": "choose_route" }],
          "provenance": "human"
        },
        {
          "id": "request-time-off/approve-directly",
          "name": "Approved automatically",
          "description": "Short requests need no one's sign-off.",
          "actor": "System",
          "kind": "step",
          "files": [
            { "file": "app/leave/service.py", "contribution": "owner", "label": "service.py: approve_directly" }
          ],
          "evidence": [
            { "path": "app/leave/service.py", "start_line": 30, "end_line": 31, "symbol": "submit_request" },
            { "path": "app/leave/service.py", "start_line": 40, "end_line": 41, "symbol": "approve_directly" }
          ],
          "provenance": "human"
        },
        {
          "id": "request-time-off/self-approve",
          "name": "Manager approves their own break",
          "description": "A manager's short request is approved in their own name, with no one above them asked.",
          "actor": "Manager",
          "kind": "step",
          "files": [
            { "file": "app/leave/service.py", "contribution": "owner", "label": "service.py: self_approve" }
          ],
          "evidence": [
            { "path": "app/leave/service.py", "start_line": 32, "end_line": 33, "symbol": "submit_request" },
            { "path": "app/leave/service.py", "start_line": 44, "end_line": 45, "symbol": "self_approve" }
          ],
          "provenance": "human"
        },
        {
          "id": "request-time-off/notify-manager",
          "name": "Manager is asked to review",
          "description": "The employee's manager gets an email saying a request is waiting.",
          "actor": "System",
          "kind": "step",
          "files": [
            { "file": "app/leave/service.py", "contribution": "helper", "label": "service.py: notify_manager.delay" },
            { "file": "app/leave/tasks.py", "contribution": "owner", "label": "tasks.py: notify_manager" },
            { "file": "app/shared/notifications.py", "contribution": "shared_system", "label": "notifications.py: send_email" }
          ],
          "evidence": [
            { "path": "app/leave/service.py", "start_line": 34, "end_line": 35, "symbol": "submit_request" },
            { "path": "app/leave/tasks.py", "start_line": 8, "end_line": 13, "symbol": "notify_manager" }
          ],
          "provenance": "human"
        },
        {
          "id": "request-time-off/manager-review",
          "name": "Manager approves or declines",
          "description": "The manager (or anyone in HR) says yes or no. Only the requester's own manager may decide, and only once.",
          "actor": "Manager",
          "kind": "decision",
          "files": [
            { "file": "app/leave/routes.py", "contribution": "owner", "label": "routes.py: approve_leave, reject_leave" },
            { "file": "app/leave/service.py", "contribution": "owner", "label": "service.py: approve_by_manager, _check_reviewer" },
            { "file": "app/shared/auth.py", "contribution": "shared_system", "label": "auth.py: require_manager" }
          ],
          "evidence": [
            { "path": "app/leave/routes.py", "start_line": 24, "end_line": 31 },
            { "path": "app/leave/service.py", "start_line": 48, "end_line": 52, "symbol": "approve_by_manager" },
            { "path": "app/leave/service.py", "start_line": 65, "end_line": 69, "symbol": "_check_reviewer" }
          ],
          "provenance": "human"
        },
        {
          "id": "request-time-off/request-declined",
          "name": "Request declined",
          "description": "The request is marked declined, logged, and the employee is emailed. Nothing comes off the balance.",
          "actor": "Manager",
          "kind": "end",
          "files": [
            { "file": "app/leave/service.py", "contribution": "owner", "label": "service.py: reject_by_manager" },